{
  "schema_version": 1,
  "revision": 1,
  "device": {
    "display_name": "Living Room",
    "preferred_display": "auto"
  },
  "ui": {
    "theme": "den-dark",
    "accent": "#79A889",
    "text_scale": 1.0,
    "tile_density": "comfortable",
    "safe_margin_percent": 3,
    "reduced_motion": false,
    "hero_enabled": true
  },
  "applications": [
    {
      "id": "plex-htpc",
      "label": "Plex",
      "adapter": "plex-htpc",
      "launch": {
        "kind": "flatpak",
        "app_id": "tv.plex.PlexHTPC",
        "args": []
      },
      "home_policy": "pause-if-supported",
      "remote_enabled": true
    },
    {
      "id": "youtube",
      "label": "YouTube",
      "adapter": "vacuumtube",
      "launch": {
        "kind": "flatpak",
        "app_id": "rocks.shy.VacuumTube",
        "args": [
          "--fullscreen",
          "--no-window-decorations"
        ]
      },
      "home_policy": "pause-if-supported",
      "remote_enabled": true
    }
  ],
  "sections": [
    {
      "id": "favorites",
      "title": "Your Apps",
      "kind": "applications",
      "enabled": true,
      "application_ids": [
        "plex-htpc",
        "youtube"
      ]
    },
    {
      "id": "plex-continue",
      "title": "Continue Watching",
      "kind": "plex-continue-watching",
      "enabled": false
    },
    {
      "id": "plex-recent",
      "title": "Recently Added",
      "kind": "plex-recently-added",
      "enabled": false
    }
  ],
  "plex_content": {
    "enabled": false,
    "connection_ref": null
  },
  "remote": {
    "enabled": false,
    "transport": "trusted-lan-http",
    "port": 8090,
    "interfaces": [],
    "mdns": true,
    "http_layout_editing": false,
    "pairing_expiry_seconds": 120,
    "pairing_max_attempts": 5,
    "https": {
      "certificate_file": null,
      "private_key_file": null
    }
  },
  "cache": {
    "artwork_max_mib": 512
  },
  "startup": {
    "autostart_enabled": false
  },
  "privacy": {
    "telemetry_enabled": false
  }
}
